{
  "cases": [
    {
      "caseId": "D001",
      "expectedKind": "result",
      "fault": null,
      "oraclePath": "fixtures/oracle/development/D001.json",
      "panels": [
        {
          "bytes": 91932,
          "height": 1600,
          "mimeType": "image/png",
          "panelId": "panel-1",
          "path": "fixtures/development/cases/D001/panels/panel-1.png",
          "sha256": "b316b6130b9dfb197609eb29ff375bded244a8fca75c5b580004ccb843cbe758",
          "width": 1200
        }
      ],
      "partition": "development",
      "referencePath": "fixtures/development/cases/D001/reference.json",
      "scenarioTags": [
        "exact",
        "single_panel",
        "clean"
      ],
      "sealed": false,
      "submissionMode": "ui",
      "title": "Exact clean domestic label"
    },
    {
      "caseId": "D002",
      "expectedKind": "result",
      "fault": null,
      "oraclePath": "fixtures/oracle/development/D002.json",
      "panels": [
        {
          "bytes": 91878,
          "height": 1600,
          "mimeType": "image/png",
          "panelId": "panel-1",
          "path": "fixtures/development/cases/D002/panels/panel-1.png",
          "sha256": "3316a21184ad0ed025f18055dde6083d855e46b53b0c98908faf488e8e40909e",
          "width": 1200
        }
      ],
      "partition": "development",
      "referencePath": "fixtures/development/cases/D002/reference.json",
      "scenarioTags": [
        "brand",
        "case_variation",
        "review"
      ],
      "sealed": false,
      "submissionMode": "ui",
      "title": "Brand case variation routes to review"
    },
    {
      "caseId": "D003",
      "expectedKind": "result",
      "fault": null,
      "oraclePath": "fixtures/oracle/development/D003.json",
      "panels": [
        {
          "bytes": 88861,
          "height": 1600,
          "mimeType": "image/png",
          "panelId": "panel-1",
          "path": "fixtures/development/cases/D003/panels/panel-1.png",
          "sha256": "09f1f38628a20c4b9bfc37249c236b39fd4a41aa46d8456f55f6d423fc124e1b",
          "width": 1200
        }
      ],
      "partition": "development",
      "referencePath": "fixtures/development/cases/D003/reference.json",
      "scenarioTags": [
        "brand",
        "class_type",
        "punctuation",
        "ambiguity"
      ],
      "sealed": false,
      "submissionMode": "ui",
      "title": "Brand punctuation and class ambiguity"
    },
    {
      "caseId": "D004",
      "expectedKind": "result",
      "fault": null,
      "oraclePath": "fixtures/oracle/development/D004.json",
      "panels": [
        {
          "bytes": 93011,
          "height": 1600,
          "mimeType": "image/png",
          "panelId": "panel-1",
          "path": "fixtures/development/cases/D004/panels/panel-1.png",
          "sha256": "036ca5c2eb833dd99b7e3591fdad7ea0dfa6afc05087209099116aeff2531fcc",
          "width": 1200
        }
      ],
      "partition": "development",
      "referencePath": "fixtures/development/cases/D004/reference.json",
      "scenarioTags": [
        "brand",
        "mismatch"
      ],
      "sealed": false,
      "submissionMode": "ui",
      "title": "Definite brand difference"
    },
    {
      "caseId": "D005",
      "expectedKind": "result",
      "fault": null,
      "oraclePath": "fixtures/oracle/development/D005.json",
      "panels": [
        {
          "bytes": 86345,
          "height": 1600,
          "mimeType": "image/png",
          "panelId": "panel-1",
          "path": "fixtures/development/cases/D005/panels/panel-1.png",
          "sha256": "5f4c7625394c9a00d061d23ee84c2c3d965ffbcb62057aba0d74373a6ca39294",
          "width": 1200
        }
      ],
      "partition": "development",
      "referencePath": "fixtures/development/cases/D005/reference.json",
      "scenarioTags": [
        "class_type",
        "mismatch"
      ],
      "sealed": false,
      "submissionMode": "ui",
      "title": "Definite class type difference"
    },
    {
      "caseId": "D006",
      "expectedKind": "result",
      "fault": null,
      "oraclePath": "fixtures/oracle/development/D006.json",
      "panels": [
        {
          "bytes": 91540,
          "height": 1600,
          "mimeType": "image/png",
          "panelId": "panel-1",
          "path": "fixtures/development/cases/D006/panels/panel-1.png",
          "sha256": "87b6d12194829ae885244058de16e74b469de7fc009413b6005bcf70fd12117b",
          "width": 1200
        }
      ],
      "partition": "development",
      "referencePath": "fixtures/development/cases/D006/reference.json",
      "scenarioTags": [
        "abv",
        "proof",
        "net_contents",
        "mismatch"
      ],
      "sealed": false,
      "submissionMode": "ui",
      "title": "ABV proof and net contents differences"
    },
    {
      "caseId": "D007",
      "expectedKind": "result",
      "fault": null,
      "oraclePath": "fixtures/oracle/development/D007.json",
      "panels": [
        {
          "bytes": 96283,
          "height": 1600,
          "mimeType": "image/png",
          "panelId": "panel-1",
          "path": "fixtures/development/cases/D007/panels/panel-1.png",
          "sha256": "cd5811a3083704749b6d2ad680d3deadb356394cbae4494dc6e3224c7940b066",
          "width": 1200
        }
      ],
      "partition": "development",
      "referencePath": "fixtures/development/cases/D007/reference.json",
      "scenarioTags": [
        "wine",
        "net_contents",
        "safe_equivalence"
      ],
      "sealed": false,
      "submissionMode": "ui",
      "title": "Wine with equivalent liter net contents"
    },
    {
      "caseId": "D008",
      "expectedKind": "result",
      "fault": null,
      "oraclePath": "fixtures/oracle/development/D008.json",
      "panels": [
        {
          "bytes": 84374,
          "height": 1600,
          "mimeType": "image/png",
          "panelId": "panel-1",
          "path": "fixtures/development/cases/D008/panels/panel-1.png",
          "sha256": "1abd6301a3c412329a360e5501bdeaeb765602a55320030c5b5ab63a48e0177a",
          "width": 1200
        }
      ],
      "partition": "development",
      "referencePath": "fixtures/development/cases/D008/reference.json",
      "scenarioTags": [
        "malt_beverage",
        "producer",
        "punctuation",
        "review"
      ],
      "sealed": false,
      "submissionMode": "ui",
      "title": "Malt beverage producer punctuation variation"
    },
    {
      "caseId": "D009",
      "expectedKind": "result",
      "fault": null,
      "oraclePath": "fixtures/oracle/development/D009.json",
      "panels": [
        {
          "bytes": 34374,
          "height": 1600,
          "mimeType": "image/png",
          "panelId": "panel-1",
          "path": "fixtures/development/cases/D009/panels/panel-1.png",
          "sha256": "4df695b8cfb09f436676eb11497e0be2dd4af971941cfa67aa5c04e8ac7da72f",
          "width": 1200
        },
        {
          "bytes": 72586,
          "height": 1600,
          "mimeType": "image/png",
          "panelId": "panel-2",
          "path": "fixtures/development/cases/D009/panels/panel-2.png",
          "sha256": "3f98bf80bf406b506d82bd1e368a5b7c4f0273cba81e3f53346aef3dc1a9494c",
          "width": 1200
        },
        {
          "bytes": 18384,
          "height": 1600,
          "mimeType": "image/png",
          "panelId": "panel-3",
          "path": "fixtures/development/cases/D009/panels/panel-3.png",
          "sha256": "5a5a2cc3dbfe43731ea8eb75f9dc3bb6105166d79deb8a0b5b8a0c7a88c174f0",
          "width": 1200
        }
      ],
      "partition": "development",
      "referencePath": "fixtures/development/cases/D009/reference.json",
      "scenarioTags": [
        "country",
        "imported",
        "multi_panel",
        "exact"
      ],
      "sealed": false,
      "submissionMode": "ui",
      "title": "Imported country exact match"
    },
    {
      "caseId": "D010",
      "expectedKind": "result",
      "fault": null,
      "oraclePath": "fixtures/oracle/development/D010.json",
      "panels": [
        {
          "bytes": 34374,
          "height": 1600,
          "mimeType": "image/png",
          "panelId": "panel-1",
          "path": "fixtures/development/cases/D010/panels/panel-1.png",
          "sha256": "4df695b8cfb09f436676eb11497e0be2dd4af971941cfa67aa5c04e8ac7da72f",
          "width": 1200
        },
        {
          "bytes": 18384,
          "height": 1600,
          "mimeType": "image/png",
          "panelId": "panel-2",
          "path": "fixtures/development/cases/D010/panels/panel-2.png",
          "sha256": "5a5a2cc3dbfe43731ea8eb75f9dc3bb6105166d79deb8a0b5b8a0c7a88c174f0",
          "width": 1200
        },
        {
          "bytes": 19413,
          "height": 1600,
          "mimeType": "image/png",
          "panelId": "panel-3",
          "path": "fixtures/development/cases/D010/panels/panel-3.png",
          "sha256": "d6330ce580d1c752bd47d8e00dcc57e9da77f854c4fc2e852caf01ee72d6a945",
          "width": 1200
        }
      ],
      "partition": "development",
      "referencePath": "fixtures/development/cases/D010/reference.json",
      "scenarioTags": [
        "country",
        "imported",
        "ambiguity",
        "multi_panel"
      ],
      "sealed": false,
      "submissionMode": "ui",
      "title": "Conflicting country candidates"
    },
    {
      "caseId": "D011",
      "expectedKind": "result",
      "fault": null,
      "oraclePath": "fixtures/oracle/development/D011.json",
      "panels": [
        {
          "bytes": 92565,
          "height": 1600,
          "mimeType": "image/png",
          "panelId": "panel-1",
          "path": "fixtures/development/cases/D011/panels/panel-1.png",
          "sha256": "b8a435fe45c7eaaf9575afaeb70e48091dabf591cf73d064f81511f2b0354da2",
          "width": 1200
        }
      ],
      "partition": "development",